{
  "$schema": "http://json-schema.org/draft-07/schema#",
  "$id": "https://github.com/Jumpstile/ChannelForge/schemas/categories.schema.json",
  "title": "ChannelForge Lineup Category Policy",
  "description": "Shape contract for data/lineup/categories.json. This validates structure only. It intentionally does not enumerate specific category names, since the set of categories is expected to vary per deployment and change over time.",
  "type": "object",
  "required": ["primary_categories"],
  "additionalProperties": false,
  "properties": {
    "_comment": {
      "type": "string",
      "description": "Optional documentation note. Ignored by any reader of this file."
    },
    "primary_categories": {
      "type": "array",
      "minItems": 1,
      "items": { "type": "string", "minLength": 1 },
      "description": "Ordered list of category labels that make up the primary lineup."
    },
    "exclude_groups": {
      "type": "array",
      "items": { "type": "string", "minLength": 1 },
      "description": "Optional list of provider group labels to drop entirely before categorization."
    },
    "adult_policy": {
      "type": "string",
      "description": "Optional free-text policy note for adult content handling."
    },
    "international_policy": {
      "type": "string",
      "description": "Optional free-text policy note for international content handling."
    }
  }
}
